{"$schema":"https://json-schema.org/draft/2020-12/schema","type":"object","required":["schema_version","generated_at","time_range","total_count","vulnerabilities"],"properties":{"schema_version":{"const":"1.0"},"generated_at":{"type":"string"},"time_range":{"type":"object"},"total_count":{"type":"integer"},"vulnerabilities":{"type":"array","items":{"type":"object","required":["cve_id","bulletin_date","severity","type","component","component_category","affected_versions","vendor","bulletin_url"],"properties":{"severity":{"enum":["Critical","High","Moderate","Low"]},"component_category":{"enum":["Framework","System","Media","Kernel","Vendor"]}}}}}}
