{
  "schema_version": "1.0",
  "generated_at": "2026-06-12T00:28:12.332981+00:00",
  "time_range": {
    "start": "2026-01",
    "end": "2026-06"
  },
  "total_count": 239,
  "vulnerabilities": [
    {
      "cve_id": "CVE-2025-54957",
      "bulletin_date": "2026-01-01",
      "patch_level": "2026-01-01",
      "severity": "Critical",
      "type": "N/A",
      "component": "DD+ Codec",
      "component_category": "Media",
      "affected_versions": [],
      "vendor": "AOSP",
      "bulletin_url": "https://source.android.com/docs/security/bulletin/2026/2026-01-01"
    },
    {
      "cve_id": "CVE-2026-0047",
      "bulletin_date": "2026-03-01",
      "patch_level": "2026-03-01",
      "severity": "Critical",
      "type": "EoP",
      "component": "Framework",
      "component_category": "Framework",
      "affected_versions": [
        "16-qpr2"
      ],
      "vendor": "AOSP",
      "bulletin_url": "https://source.android.com/docs/security/bulletin/2026/2026-03-01"
    },
    {
      "cve_id": "CVE-2025-32313",
      "bulletin_date": "2026-03-01",
      "patch_level": "2026-03-01",
      "severity": "High",
      "type": "EoP",
      "component": "Framework",
      "component_category": "Framework",
      "affected_versions": [
        "14",
        "15",
        "16"
      ],
      "vendor": "AOSP",
      "bulletin_url": "https://source.android.com/docs/security/bulletin/2026/2026-03-01"
    },
    {
      "cve_id": "CVE-2025-48544",
      "bulletin_date": "2026-03-01",
      "patch_level": "2026-03-01",
      "severity": "High",
      "type": "EoP",
      "component": "Framework",
      "component_category": "Framework",
      "affected_versions": [
        "14",
        "15",
        "16"
      ],
      "vendor": "AOSP",
      "bulletin_url": "https://source.android.com/docs/security/bulletin/2026/2026-03-01"
    },
    {
      "cve_id": "CVE-2025-48567",
      "bulletin_date": "2026-03-01",
      "patch_level": "2026-03-01",
      "severity": "High",
      "type": "EoP",
      "component": "Framework",
      "component_category": "Framework",
      "affected_versions": [
        "14",
        "15",
        "16"
      ],
      "vendor": "AOSP",
      "bulletin_url": "https://source.android.com/docs/security/bulletin/2026/2026-03-01"
    },
    {
      "cve_id": "CVE-2025-48568",
      "bulletin_date": "2026-03-01",
      "patch_level": "2026-03-01",
      "severity": "High",
      "type": "EoP",
      "component": "Framework",
      "component_category": "Framework",
      "affected_versions": [
        "14",
        "15"
      ],
      "vendor": "AOSP",
      "bulletin_url": "https://source.android.com/docs/security/bulletin/2026/2026-03-01"
    },
    {
      "cve_id": "CVE-2025-48574",
      "bulletin_date": "2026-03-01",
      "patch_level": "2026-03-01",
      "severity": "High",
      "type": "EoP",
      "component": "Framework",
      "component_category": "Framework",
      "affected_versions": [
        "14",
        "15",
        "16"
      ],
      "vendor": "AOSP",
      "bulletin_url": "https://source.android.com/docs/security/bulletin/2026/2026-03-01"
    },
    {
      "cve_id": "CVE-2025-48578",
      "bulletin_date": "2026-03-01",
      "patch_level": "2026-03-01",
      "severity": "High",
      "type": "EoP",
      "component": "Framework",
      "component_category": "Framework",
      "affected_versions": [
        "14",
        "15",
        "16"
      ],
      "vendor": "AOSP",
      "bulletin_url": "https://source.android.com/docs/security/bulletin/2026/2026-03-01"
    },
    {
      "cve_id": "CVE-2025-48579",
      "bulletin_date": "2026-03-01",
      "patch_level": "2026-03-01",
      "severity": "High",
      "type": "EoP",
      "component": "Framework",
      "component_category": "Framework",
      "affected_versions": [
        "14",
        "15",
        "16"
      ],
      "vendor": "AOSP",
      "bulletin_url": "https://source.android.com/docs/security/bulletin/2026/2026-03-01"
    },
    {
      "cve_id": "CVE-2025-48582",
      "bulletin_date": "2026-03-01",
      "patch_level": "2026-03-01",
      "severity": "High",
      "type": "EoP",
      "component": "Framework",
      "component_category": "Framework",
      "affected_versions": [
        "14",
        "15",
        "16"
      ],
      "vendor": "AOSP",
      "bulletin_url": "https://source.android.com/docs/security/bulletin/2026/2026-03-01"
    },
    {
      "cve_id": "CVE-2025-48619",
      "bulletin_date": "2026-03-01",
      "patch_level": "2026-03-01",
      "severity": "High",
      "type": "EoP",
      "component": "Framework",
      "component_category": "Framework",
      "affected_versions": [
        "14",
        "15",
        "16"
      ],
      "vendor": "AOSP",
      "bulletin_url": "https://source.android.com/docs/security/bulletin/2026/2026-03-01"
    },
    {
      "cve_id": "CVE-2025-48634",
      "bulletin_date": "2026-03-01",
      "patch_level": "2026-03-01",
      "severity": "High",
      "type": "EoP",
      "component": "Framework",
      "component_category": "Framework",
      "affected_versions": [
        "14",
        "15",
        "16"
      ],
      "vendor": "AOSP",
      "bulletin_url": "https://source.android.com/docs/security/bulletin/2026/2026-03-01"
    },
    {
      "cve_id": "CVE-2025-48635",
      "bulletin_date": "2026-03-01",
      "patch_level": "2026-03-01",
      "severity": "High",
      "type": "EoP",
      "component": "Framework",
      "component_category": "Framework",
      "affected_versions": [
        "14",
        "15"
      ],
      "vendor": "AOSP",
      "bulletin_url": "https://source.android.com/docs/security/bulletin/2026/2026-03-01"
    },
    {
      "cve_id": "CVE-2025-48645",
      "bulletin_date": "2026-03-01",
      "patch_level": "2026-03-01",
      "severity": "High",
      "type": "EoP",
      "component": "Framework",
      "component_category": "Framework",
      "affected_versions": [
        "14",
        "15",
        "16",
        "16-qpr2"
      ],
      "vendor": "AOSP",
      "bulletin_url": "https://source.android.com/docs/security/bulletin/2026/2026-03-01"
    },
    {
      "cve_id": "CVE-2025-48646",
      "bulletin_date": "2026-03-01",
      "patch_level": "2026-03-01",
      "severity": "High",
      "type": "EoP",
      "component": "Framework",
      "component_category": "Framework",
      "affected_versions": [
        "14",
        "15",
        "16",
        "16-qpr2"
      ],
      "vendor": "AOSP",
      "bulletin_url": "https://source.android.com/docs/security/bulletin/2026/2026-03-01"
    },
    {
      "cve_id": "CVE-2025-48654",
      "bulletin_date": "2026-03-01",
      "patch_level": "2026-03-01",
      "severity": "High",
      "type": "EoP",
      "component": "Framework",
      "component_category": "Framework",
      "affected_versions": [
        "16",
        "16-qpr2"
      ],
      "vendor": "AOSP",
      "bulletin_url": "https://source.android.com/docs/security/bulletin/2026/2026-03-01"
    },
    {
      "cve_id": "CVE-2026-0010",
      "bulletin_date": "2026-03-01",
      "patch_level": "2026-03-01",
      "severity": "High",
      "type": "EoP",
      "component": "Framework",
      "component_category": "Framework",
      "affected_versions": [
        "14",
        "15",
        "16"
      ],
      "vendor": "AOSP",
      "bulletin_url": "https://source.android.com/docs/security/bulletin/2026/2026-03-01"
    },
    {
      "cve_id": "CVE-2026-0011",
      "bulletin_date": "2026-03-01",
      "patch_level": "2026-03-01",
      "severity": "High",
      "type": "EoP",
      "component": "Framework",
      "component_category": "Framework",
      "affected_versions": [
        "14",
        "15",
        "16",
        "16-qpr2"
      ],
      "vendor": "AOSP",
      "bulletin_url": "https://source.android.com/docs/security/bulletin/2026/2026-03-01"
    },
    {
      "cve_id": "CVE-2026-0013",
      "bulletin_date": "2026-03-01",
      "patch_level": "2026-03-01",
      "severity": "High",
      "type": "EoP",
      "component": "Framework",
      "component_category": "Framework",
      "affected_versions": [
        "14",
        "15",
        "16"
      ],
      "vendor": "AOSP",
      "bulletin_url": "https://source.android.com/docs/security/bulletin/2026/2026-03-01"
    },
    {
      "cve_id": "CVE-2026-0020",
      "bulletin_date": "2026-03-01",
      "patch_level": "2026-03-01",
      "severity": "High",
      "type": "EoP",
      "component": "Framework",
      "component_category": "Framework",
      "affected_versions": [
        "14",
        "15",
        "16",
        "16-qpr2"
      ],
      "vendor": "AOSP",
      "bulletin_url": "https://source.android.com/docs/security/bulletin/2026/2026-03-01"
    },
    {
      "cve_id": "CVE-2026-0023",
      "bulletin_date": "2026-03-01",
      "patch_level": "2026-03-01",
      "severity": "High",
      "type": "EoP",
      "component": "Framework",
      "component_category": "Framework",
      "affected_versions": [
        "14",
        "15",
        "16",
        "16-qpr2"
      ],
      "vendor": "AOSP",
      "bulletin_url": "https://source.android.com/docs/security/bulletin/2026/2026-03-01"
    },
    {
      "cve_id": "CVE-2026-0026",
      "bulletin_date": "2026-03-01",
      "patch_level": "2026-03-01",
      "severity": "High",
      "type": "EoP",
      "component": "Framework",
      "component_category": "Framework",
      "affected_versions": [
        "14"
      ],
      "vendor": "AOSP",
      "bulletin_url": "https://source.android.com/docs/security/bulletin/2026/2026-03-01"
    },
    {
      "cve_id": "CVE-2026-0034",
      "bulletin_date": "2026-03-01",
      "patch_level": "2026-03-01",
      "severity": "High",
      "type": "EoP",
      "component": "Framework",
      "component_category": "Framework",
      "affected_versions": [
        "14",
        "15",
        "16",
        "16-qpr2"
      ],